{
  "candidate": {
    "canonicalization": "canonical_json_v1",
    "input_mode": "structured_json",
    "privacy_policy_id": "privacy.no_secrets_v1",
    "schema_digest": "sha256:f94b322391f430e72a741ff49ba670447ae08e59f0063c2e59bb18ef753f5c16",
    "schema_ref": "https://phase-tool.local/schemas/file-create-candidate.schema.json"
  },
  "canonical_result": {
    "authority_rule": "authority.exclusive_create_v1",
    "locator_template": "{target_locator}",
    "owner_id": "file.create.owner",
    "result_reference_schema_ref": "https://phase-tool.local/schemas/phase-result-reference.schema.json",
    "result_schema_digest": "sha256:6c290d7d81ba589b4bac4e59ff0fce81caa2ef1dc04a29832b925da929e1393b",
    "result_schema_ref": "https://phase-tool.local/schemas/file-create-result.schema.json",
    "root_binding": "phase_result_root"
  },
  "evidence": {
    "receipt_schema_digest": "sha256:e4e1126d71be6e05049ac57a9acb38ed92540a7b14ac90fb2bf45225e060de0d",
    "receipt_schema_ref": "https://phase-tool.local/schemas/phase-receipt.schema.json",
    "redaction_policy_id": "redaction.no_secrets_v1",
    "required_attachment_kinds": [
      "effect_receipts",
      "validator_results"
    ],
    "retention_policy_id": "retention.canonical_file_v1"
  },
  "idempotency": {
    "incomplete_previous_execution": "inspect_before_retry",
    "key_required": true,
    "request_digest_policy_id": "digest.canonical_request_v1",
    "same_key_different_digest": "conflict",
    "same_key_same_digest": "return_existing_verified",
    "scope_fields": [
      "contract",
      "result_locator",
      "operation_intent"
    ],
    "success_lookup": "canonical_result_then_receipt"
  },
  "identity": {
    "core_compatibility": {
      "maximum_exclusive": "2.0.0",
      "minimum": "1.0.0"
    },
    "id": "file_create.v1",
    "version": "1.0.0"
  },
  "input_bindings": [
    {
      "freeze_strategy": "copy_and_hash",
      "id": "payload",
      "mutable_upstream_after_freeze": "forbidden",
      "provenance_required": false,
      "required": true,
      "schema_digest": null,
      "schema_ref": null
    }
  ],
  "operation": {
    "allowed_effects": [
      "exclusive_create"
    ],
    "atomicity_claim": "single_effect",
    "effect_order": "static_predeclared",
    "intent": "create",
    "maximum_effects": 1,
    "mechanism": {
      "availability": "bundled_v1",
      "capability": "mutation_mechanism",
      "id": "mechanism.exclusive_create_v1",
      "package_digest": "sha256:79564033bced595dda6c50b139c85d350c2eabbfbe586a17cfcbe5037884411b",
      "version": "1.0.0"
    },
    "required_guarantees": {
      "mechanisms": [
        {
          "all_of": [
            "exclusive_create",
            "readback_verification",
            "cross_process_serialization"
          ],
          "mechanism": {
            "id": "mechanism.exclusive_create_v1",
            "package_digest": "sha256:79564033bced595dda6c50b139c85d350c2eabbfbe586a17cfcbe5037884411b",
            "version": "1.0.0"
          }
        }
      ],
      "vocabulary": {
        "descriptor_digest": "sha256:f7b158004b0bf7041286269c239c381cfd60db5987c6bf2173c645d5ac146624",
        "id": "phase.mutation-guarantees",
        "version": "1.0.0"
      }
    }
  },
  "outcomes": {
    "committed_unverified": "committed_unverified",
    "known_no_effect": "failed_no_effect",
    "known_partial": "failed_partial",
    "pre_mutation_rejection": "rejected",
    "success": "succeeded_verified",
    "unknown_result": "indeterminate"
  },
  "phase_contract_version": "1.0",
  "recovery": {
    "automatic": false,
    "policy": "none",
    "requires_exact_before_state": false
  },
  "validators": [
    {
      "binding": {
        "capability": "validator",
        "id": "validator.exact_binding_v1",
        "package_digest": "sha256:19f8b652b094e3079226d506bc6111ae8124e35807e54183e23d95bb13188bb3",
        "version": "1.0.0"
      },
      "blocking": true,
      "config": {},
      "phase": "contract"
    },
    {
      "binding": {
        "capability": "validator",
        "id": "fixture.create.candidate_v1",
        "package_digest": "sha256:a31ec19f1572680a4a096d05d8d0df7dded7de79329605f9550855c1464bd6db",
        "version": "1.0.0"
      },
      "blocking": true,
      "config": {},
      "phase": "candidate"
    },
    {
      "binding": {
        "capability": "validator",
        "id": "validator.frozen_blob_v1",
        "package_digest": "sha256:3dfe6c8051f2ce6c24f1f9dc6589a95a6b3f49d6d2417f8f9562678bf2d16039",
        "version": "1.0.0"
      },
      "blocking": true,
      "config": {},
      "phase": "input"
    },
    {
      "binding": {
        "capability": "validator",
        "id": "validator.destination_absent_v1",
        "package_digest": "sha256:1b98144e9398a1a9e44c2f7bbb29eacf23700a397408310de939285a9f852112",
        "version": "1.0.0"
      },
      "blocking": true,
      "config": {},
      "phase": "pre_operation"
    },
    {
      "binding": {
        "capability": "validator",
        "id": "validator.result_digest_v1",
        "package_digest": "sha256:fe1ec09ae9e0162090b2908feba7e51b293ac62e2a6a2f963aef4a9690592372",
        "version": "1.0.0"
      },
      "blocking": true,
      "config": {},
      "phase": "post_operation"
    }
  ],
  "verification": {
    "observation_scope": "result_only",
    "required_predicates": [
      "digest_matches",
      "length_matches",
      "regular_file"
    ],
    "validators": [
      {
        "capability": "validator",
        "id": "validator.result_digest_v1",
        "package_digest": "sha256:fe1ec09ae9e0162090b2908feba7e51b293ac62e2a6a2f963aef4a9690592372",
        "version": "1.0.0"
      }
    ]
  },
  "write_scope": {
    "default_path_policy": {
      "capability": "path_policy",
      "id": "path.strict_local_v1",
      "package_digest": "sha256:238b3431352a94dab33ffa0190fd78cd2825679377cb0e14dfa4bd4c6da8b0f4",
      "version": "1.0.0"
    },
    "forbidden_root_bindings": [
      "phase_evidence_root"
    ],
    "roots": [
      {
        "access": "write",
        "binding_id": "phase_result_root",
        "path_policy": {
          "capability": "path_policy",
          "id": "path.strict_local_v1",
          "package_digest": "sha256:238b3431352a94dab33ffa0190fd78cd2825679377cb0e14dfa4bd4c6da8b0f4",
          "version": "1.0.0"
        },
        "reparse_policy": "reject",
        "symlink_policy": "reject"
      }
    ]
  }
}
