{
  "candidate": {
    "canonicalization": "admission_canonical_json_v1",
    "input_mode": "structured_json",
    "privacy_policy_id": "privacy.no_secrets_v1",
    "schema_digest": "sha256:911a2e0b8016124f2d02d0183bc41681e21f54e37b31f4a1c10b072e4c293965",
    "schema_ref": "https://phase-tool.local/spec-candidates/admission-v1/schemas/knowledge-admission-candidate.schema.json"
  },
  "canonical_result": {
    "authority_rule": "authority.knowledge_descriptor_v1",
    "locator_template": "namespaces/{namespace}/knowledge-results/{logical_knowledge_id}/{knowledge_result_id}.json",
    "owner_id": "knowledge_admission.v1",
    "result_reference_schema_ref": "https://phase-tool.local/schemas/phase-result-reference.schema.json",
    "result_schema_digest": "sha256:8aba25ac57cde54a2371c2ace8da58dc1f9694663c71a88ab49d6e4f99aecefc",
    "result_schema_ref": "https://phase-tool.local/spec-candidates/admission-v1/schemas/knowledge-result.schema.json",
    "root_binding": "admission_result_root"
  },
  "contract_hook": {
    "capability": "contract_hook",
    "id": "knowledge_admission.runtime_v1",
    "package_digest": "sha256:47be61e9acf5f86a87b3b6a57cc8769759f91a5ba1fe4af87d9679b705da9a93",
    "version": "1.0.0"
  },
  "evidence": {
    "receipt_schema_digest": "sha256:e4e1126d71be6e05049ac57a9acb38ed92540a7b14ac90fb2bf45225e060de0d",
    "receipt_schema_ref": "https://phase-tool.local/schemas/phase-receipt.schema.json",
    "redaction_policy_id": "redaction.no_secrets_v1",
    "required_attachment_kinds": [
      "effect_receipts",
      "ordered_effect_progress",
      "validator_results"
    ],
    "retention_policy_id": "retention.knowledge_admission_v1"
  },
  "idempotency": {
    "incomplete_previous_execution": "inspect_before_retry",
    "key_required": true,
    "request_digest_policy_id": "digest.admission_canonical_request_v1",
    "same_key_different_digest": "conflict",
    "same_key_same_digest": "return_existing_verified",
    "scope_fields": [
      "contract",
      "result_locator",
      "operation_intent"
    ],
    "success_lookup": "canonical_result_then_receipt"
  },
  "identity": {
    "core_compatibility": {
      "maximum_exclusive": "2.0.0",
      "minimum": "1.0.0"
    },
    "id": "knowledge_admission.v1",
    "version": "1.0.0"
  },
  "input_bindings": [
    {
      "freeze_strategy": "copy_and_hash",
      "id": "asset",
      "mutable_upstream_after_freeze": "forbidden",
      "provenance_required": true,
      "required": true,
      "schema_digest": null,
      "schema_ref": null
    }
  ],
  "operation": {
    "allowed_effects": [
      "copy_blob",
      "exclusive_create"
    ],
    "atomicity_claim": "per_effect",
    "effect_mechanisms": [
      {
        "availability": "bundled_v1",
        "capability": "mutation_mechanism",
        "id": "content_addressed_copy",
        "package_digest": "sha256:ea3dd62ad45312315c30da15a8aa53566e554d4e7733ee5f41c67d1c4cf37fa2",
        "version": "1.0.0"
      },
      {
        "availability": "bundled_v1",
        "capability": "mutation_mechanism",
        "id": "mechanism.exclusive_create_v1",
        "package_digest": "sha256:79564033bced595dda6c50b139c85d350c2eabbfbe586a17cfcbe5037884411b",
        "version": "1.0.0"
      }
    ],
    "effect_order": "static_predeclared",
    "intent": "copy",
    "maximum_effects": 2,
    "mechanism": {
      "availability": "bundled_v1",
      "capability": "mutation_mechanism",
      "id": "content_addressed_copy",
      "package_digest": "sha256:ea3dd62ad45312315c30da15a8aa53566e554d4e7733ee5f41c67d1c4cf37fa2",
      "version": "1.0.0"
    },
    "required_guarantees": {
      "mechanisms": [
        {
          "all_of": [
            "exclusive_create",
            "readback_verification",
            "cross_process_serialization"
          ],
          "mechanism": {
            "id": "content_addressed_copy",
            "package_digest": "sha256:ea3dd62ad45312315c30da15a8aa53566e554d4e7733ee5f41c67d1c4cf37fa2",
            "version": "1.0.0"
          }
        },
        {
          "all_of": [
            "exclusive_create",
            "readback_verification",
            "cross_process_serialization"
          ],
          "mechanism": {
            "id": "mechanism.exclusive_create_v1",
            "package_digest": "sha256:79564033bced595dda6c50b139c85d350c2eabbfbe586a17cfcbe5037884411b",
            "version": "1.0.0"
          }
        }
      ],
      "vocabulary": {
        "descriptor_digest": "sha256:f7b158004b0bf7041286269c239c381cfd60db5987c6bf2173c645d5ac146624",
        "id": "phase.mutation-guarantees",
        "version": "1.0.0"
      }
    }
  },
  "outcomes": {
    "committed_unverified": "committed_unverified",
    "known_no_effect": "failed_no_effect",
    "known_partial": "failed_partial",
    "pre_mutation_rejection": "rejected",
    "success": "succeeded_verified",
    "unknown_result": "indeterminate"
  },
  "phase_contract_version": "1.0",
  "recovery": {
    "automatic": false,
    "policy": "none",
    "requires_exact_before_state": true
  },
  "validators": [
    {
      "binding": {
        "capability": "validator",
        "id": "validator.exact_binding_v1",
        "package_digest": "sha256:19f8b652b094e3079226d506bc6111ae8124e35807e54183e23d95bb13188bb3",
        "version": "1.0.0"
      },
      "blocking": true,
      "config": {},
      "phase": "contract"
    },
    {
      "binding": {
        "capability": "validator",
        "id": "knowledge_admission.candidate_v1",
        "package_digest": "sha256:d913a3154e094a5b0d028b29ae49a5bf35b368af5c94919cf29c2156527fb2fd",
        "version": "1.0.0"
      },
      "blocking": true,
      "config": {},
      "phase": "candidate"
    },
    {
      "binding": {
        "capability": "validator",
        "id": "knowledge_admission.source_binding_v1",
        "package_digest": "sha256:d18eac072664280a26aee09aff1d2f09e2f4ecd2973098cb6ce4e44b9ca8c75e",
        "version": "1.0.0"
      },
      "blocking": true,
      "config": {},
      "phase": "pre_operation"
    },
    {
      "binding": {
        "capability": "validator",
        "id": "knowledge_admission.provenance_v1",
        "package_digest": "sha256:ff96b9bd6121c1138863b134b17c68aeb42bce164aa3a2bd1ee4e44253968c74",
        "version": "1.0.0"
      },
      "blocking": true,
      "config": {},
      "phase": "pre_operation"
    },
    {
      "binding": {
        "capability": "validator",
        "id": "knowledge_admission.identity_v1",
        "package_digest": "sha256:f48ad27ec0fa38ce1bb2059af51b8191bc024d072e09eb18f1a1204570f160ce",
        "version": "1.0.0"
      },
      "blocking": true,
      "config": {},
      "phase": "pre_operation"
    },
    {
      "binding": {
        "capability": "validator",
        "id": "knowledge_admission.placement_v1",
        "package_digest": "sha256:85be4779388b45b0fedb10dcbe2b6bb14fba7bdd2889e7d49846709a1989ccfa",
        "version": "1.0.0"
      },
      "blocking": true,
      "config": {},
      "phase": "pre_operation"
    },
    {
      "binding": {
        "capability": "validator",
        "id": "knowledge_admission.result_v1",
        "package_digest": "sha256:319ac9afd37babe0d728d502923239afdc93a7e2c138359ee4d7545e0730f736",
        "version": "1.0.0"
      },
      "blocking": true,
      "config": {},
      "phase": "post_operation"
    },
    {
      "binding": {
        "capability": "validator",
        "id": "phase.ordered_effect_plan_progress_v1",
        "package_digest": "sha256:5026a972413b37f5988aca6e7734ba8afc0fae1ea47190190eb77d301842704a",
        "version": "1.0.0"
      },
      "blocking": true,
      "config": {},
      "phase": "post_operation"
    }
  ],
  "verification": {
    "observation_scope": "result_only",
    "required_predicates": [
      "blob_verified",
      "descriptor_verified",
      "descriptor_binds_blob",
      "source_bindings_verified"
    ],
    "validators": [
      {
        "capability": "validator",
        "id": "knowledge_admission.result_v1",
        "package_digest": "sha256:319ac9afd37babe0d728d502923239afdc93a7e2c138359ee4d7545e0730f736",
        "version": "1.0.0"
      },
      {
        "capability": "validator",
        "id": "phase.ordered_effect_plan_progress_v1",
        "package_digest": "sha256:5026a972413b37f5988aca6e7734ba8afc0fae1ea47190190eb77d301842704a",
        "version": "1.0.0"
      }
    ]
  },
  "write_scope": {
    "default_path_policy": {
      "capability": "path_policy",
      "id": "path.strict_local_v1",
      "package_digest": "sha256:238b3431352a94dab33ffa0190fd78cd2825679377cb0e14dfa4bd4c6da8b0f4",
      "version": "1.0.0"
    },
    "forbidden_root_bindings": [
      "phase_evidence_root"
    ],
    "roots": [
      {
        "access": "write",
        "binding_id": "admission_result_root",
        "path_policy": {
          "capability": "path_policy",
          "id": "path.strict_local_v1",
          "package_digest": "sha256:238b3431352a94dab33ffa0190fd78cd2825679377cb0e14dfa4bd4c6da8b0f4",
          "version": "1.0.0"
        },
        "reparse_policy": "reject",
        "symlink_policy": "reject"
      }
    ]
  }
}
